{
 "schema": 1,
 "edition": "iclr-2025",
 "series": "iclr",
 "year": 2025,
 "method_version": "0.1.0",
 "citation_zh": "来源：dblp 收录的 ICLR 2025 录用论文标题（CC0），NextVenue 按关键词归类统计（方法 v0.1.0，一篇论文可计入多个主题）",
 "scope_zh": "主会",
 "source": {
  "name": "dblp",
  "license": "CC0 1.0",
  "tocs": [
   "https://dblp.org/db/conf/iclr/iclr2025"
  ],
  "retrieved_at": "2026-09-25T09:49:15Z"
 },
 "papers_used": 3704,
 "official_accepted": {
  "value": 3704,
  "source_url": "https://media.iclr.cc/Conferences/ICLR2025/ICLR2025_Fact_Sheet.pdf",
  "quote": "11,603 submissions, 3704 accepted ... 32% acceptance rate (last year: 31%)",
  "src": "iclr-2025-fact-sheet",
  "quote_check": "snapshot"
 },
 "coverage": 1.0,
 "topics": [
  {
   "rank": 1,
   "id": "llm",
   "label_zh": "大语言模型",
   "label_en": "LLMs / language models",
   "count": 651,
   "share_pct": 17.6,
   "prev": {
    "year": 2024,
    "count": 281,
    "share_pct": 12.4,
    "delta_pp": 5.2
   },
   "examples": [
    "Efficient Inference for Large Language Model-based Generative Recommendation.",
    "PEARL: Towards Permutation-Resilient LLMs.",
    "Bi-Factorial Preference Optimization: Balancing Safety-Helpfulness in Language Models."
   ]
  },
  {
   "rank": 2,
   "id": "diffusion",
   "label_zh": "扩散模型 / 流匹配",
   "label_en": "Diffusion / flow-matching models",
   "count": 313,
   "share_pct": 8.5,
   "prev": {
    "year": 2024,
    "count": 171,
    "share_pct": 7.6,
    "delta_pp": 0.9
   },
   "examples": [
    "Efficient Multi-agent Offline Coordination via Diffusion-based Trajectory Stitching.",
    "HD-Painter: High-Resolution and Prompt-Faithful Text-Guided Image Inpainting with Diffusion Models.",
    "Diff-PIC: Revolutionizing Particle-In-Cell Nuclear Fusion Simulation with Diffusion Models."
   ]
  },
  {
   "rank": 3,
   "id": "benchmark",
   "label_zh": "基准、数据集与评测",
   "label_en": "Benchmarks, datasets & evaluation",
   "count": 275,
   "share_pct": 7.4,
   "prev": {
    "year": 2024,
    "count": 109,
    "share_pct": 4.8,
    "delta_pp": 2.6
   },
   "low_precision": true,
   "examples": [
    "TAU-106K: A New Dataset for Comprehensive Understanding of Traffic Accident.",
    "Attributing Culture-Conditioned Generations to Pretraining Corpora.",
    "MMKE-Bench: A Multimodal Editing Benchmark for Diverse Visual Knowledge."
   ]
  },
  {
   "rank": 4,
   "id": "multimodal",
   "label_zh": "多模态 / 视觉-语言",
   "label_en": "Multimodal / vision-language",
   "count": 262,
   "share_pct": 7.1,
   "prev": {
    "year": 2024,
    "count": 82,
    "share_pct": 3.6,
    "delta_pp": 3.5
   },
   "examples": [
    "SleepSMC: Ubiquitous Sleep Staging via Supervised Multimodal Coordination.",
    "OBI-Bench: Can LMMs Aid in Study of Ancient Script on Oracle Bones?",
    "Discovering Clone Negatives via Adaptive Contrastive Learning for Image-Text Matching."
   ]
  },
  {
   "rank": 5,
   "id": "robustness",
   "label_zh": "鲁棒性与对抗攻击",
   "label_en": "Robustness & adversarial attacks",
   "count": 197,
   "share_pct": 5.3,
   "prev": {
    "year": 2024,
    "count": 156,
    "share_pct": 6.9,
    "delta_pp": -1.6
   },
   "low_precision": true,
   "examples": [
    "Strong Preferences Affect the Robustness of Preference Models and Value Alignment.",
    "Demystifying Online Clustering of Bandits: Enhanced Exploration Under Stochastic and Smoothed Adversarial Contexts.",
    "RRM: Robust Reward Model Training Mitigates Reward Hacking."
   ]
  },
  {
   "rank": 6,
   "id": "transformer",
   "label_zh": "Transformer / 注意力",
   "label_en": "Transformers / attention",
   "count": 195,
   "share_pct": 5.3,
   "prev": {
    "year": 2024,
    "count": 116,
    "share_pct": 5.1,
    "delta_pp": 0.2
   },
   "examples": [
    "Circuit Transformer: A Transformer That Preserves Logical Equivalence.",
    "Differentiable and Learnable Wireless Simulation with Geometric Transformers.",
    "Gnothi Seauton: Empowering Faithful Self-Interpretability in Black-Box Transformers."
   ]
  },
  {
   "rank": 7,
   "id": "efficiency",
   "label_zh": "高效化（量化/剪枝/蒸馏/KV 缓存）",
   "label_en": "Efficiency (quantisation / pruning / distillation / KV cache)",
   "count": 181,
   "share_pct": 4.9,
   "prev": {
    "year": 2024,
    "count": 102,
    "share_pct": 4.5,
    "delta_pp": 0.4
   },
   "examples": [
    "Efficient Inference for Large Language Model-based Generative Recommendation.",
    "Accelerating Training with Neuron Interaction and Nowcasting Networks.",
    "ADAPT: Attentive Self-Distillation and Dual-Decoder Prediction Fusion for Continual Panoptic Segmentation."
   ]
  },
  {
   "rank": 8,
   "id": "safety_alignment",
   "label_zh": "安全与对齐",
   "label_en": "Safety & alignment",
   "count": 179,
   "share_pct": 4.8,
   "prev": {
    "year": 2024,
    "count": 42,
    "share_pct": 1.9,
    "delta_pp": 2.9
   },
   "examples": [
    "Bi-Factorial Preference Optimization: Balancing Safety-Helpfulness in Language Models.",
    "Language Model Alignment in Multilingual Trolley Problems.",
    "EMMA: Empowering Multi-modal Mamba with Structural and Hierarchical Alignment."
   ]
  },
  {
   "rank": 9,
   "id": "rl",
   "label_zh": "强化学习",
   "label_en": "Reinforcement learning",
   "count": 175,
   "share_pct": 4.7,
   "prev": {
    "year": 2024,
    "count": 160,
    "share_pct": 7.1,
    "delta_pp": -2.4
   },
   "examples": [
    "Learning a Fast Mixing Exogenous Block MDP using a Single Trajectory.",
    "Stable Hadamard Memory: Revitalizing Memory-Augmented Agents for Reinforcement Learning.",
    "Adding Conditional Control to Diffusion Models with Reinforcement Learning."
   ]
  },
  {
   "rank": 10,
   "id": "graph",
   "label_zh": "图学习 / GNN",
   "label_en": "Graphs / GNNs",
   "count": 171,
   "share_pct": 4.6,
   "prev": {
    "year": 2024,
    "count": 132,
    "share_pct": 5.8,
    "delta_pp": -1.2
   },
   "examples": [
    "Graph-based Document Structure Analysis.",
    "Open-Set Graph Anomaly Detection via Normal Structure Regularisation.",
    "SpaceGNN: Multi-Space Graph Neural Network for Node Anomaly Detection with Extremely Limited Labels."
   ]
  },
  {
   "rank": 11,
   "id": "theory_optim",
   "label_zh": "优化与学习理论",
   "label_en": "Optimisation & learning theory",
   "count": 171,
   "share_pct": 4.6,
   "prev": {
    "year": 2024,
    "count": 120,
    "share_pct": 5.3,
    "delta_pp": -0.7
   },
   "examples": [
    "DiSK: Differentially Private Optimizer with Simplified Kalman Filter for Noise Reduction.",
    "Last-Iterate Convergence Properties of Regret-Matching Algorithms in Games.",
    "Demystifying Online Clustering of Bandits: Enhanced Exploration Under Stochastic and Smoothed Adversarial Contexts."
   ]
  },
  {
   "rank": 12,
   "id": "3d",
   "label_zh": "3D 视觉（NeRF/高斯泼溅/点云）",
   "label_en": "3D vision (NeRF / Gaussian splatting / point clouds)",
   "count": 156,
   "share_pct": 4.2,
   "prev": {
    "year": 2024,
    "count": 82,
    "share_pct": 3.6,
    "delta_pp": 0.6
   },
   "examples": [
    "GS-CPR: Efficient Camera Pose Refinement via 3D Gaussian Splatting.",
    "Occlusion-aware Non-Rigid Point Cloud Registration via Unsupervised Neural Deformation Correntropy.",
    "ConcreTizer: Model Inversion Attack via Occupancy Classification and Dispersion Control for 3D Point Cloud Restoration."
   ]
  },
  {
   "rank": 13,
   "id": "generation",
   "label_zh": "图像/视频/3D 生成与编辑",
   "label_en": "Image / video / 3D generation & editing",
   "count": 145,
   "share_pct": 3.9,
   "prev": {
    "year": 2024,
    "count": 94,
    "share_pct": 4.2,
    "delta_pp": -0.3
   },
   "examples": [
    "PhyloVAE: Unsupervised Learning of Phylogenetic Trees via Variational Autoencoders.",
    "Rare event modeling with self-regularized normalizing flows: what can we learn from a single failure?",
    "Continuous Autoregressive Modeling with Stochastic Monotonic Alignment for Speech Synthesis."
   ]
  },
  {
   "rank": 14,
   "id": "agents",
   "label_zh": "智能体",
   "label_en": "Agents (LLM / RL / multi-agent)",
   "count": 134,
   "share_pct": 3.6,
   "prev": {
    "year": 2024,
    "count": 40,
    "share_pct": 1.8,
    "delta_pp": 1.8
   },
   "examples": [
    "KGARevion: An AI Agent for Knowledge-Intensive Biomedical QA.",
    "Efficient Multi-agent Offline Coordination via Diffusion-based Trajectory Stitching.",
    "Competing Large Language Models in Multi-Agent Gaming Environments."
   ]
  },
  {
   "rank": 15,
   "id": "finetuning",
   "label_zh": "微调 / 参数高效 / 后训练",
   "label_en": "Fine-tuning / PEFT / post-training",
   "count": 131,
   "share_pct": 3.5,
   "prev": {
    "year": 2024,
    "count": 75,
    "share_pct": 3.3,
    "delta_pp": 0.2
   },
   "examples": [
    "Instruct-SkillMix: A Powerful Pipeline for LLM Instruction Tuning.",
    "Merging LoRAs like Playing LEGO: Pushing the Modularity of LoRA to Extremes Through Rank-Wise Clustering.",
    "Joint Fine-tuning and Conversion of Pretrained Speech and Language Models towards Linear Complexity."
   ]
  }
 ]
}
